"","species_common.x","species_latin","Family","Qu.1","RationaleQu1","Qu.2","RationaleQu.2","Qu.3","RationaleQu.3","Qu.4","RationaleQu.4","Global environmental risk","AISR_Listing","Secondary_Assessment","Science_Support","Notes.x","species_common.y","taxa","listed_elsewhere","pet_aquarium","Aquaculture","rec_fish","biofouler","Bilge Water","water_garden","possible_to_overwinter","suitable_hab_suspected","Notes.y"
"1","Abbott's rivulus","Abbottina rivularis","Cyprinidae",1,"The main pathway for A. rivularis is the fish seed transfer between farms.",3,"Abbottina rivularis inhabits lowland aquatic habitats such as irrigation channels, ponds, and lakes (Hosoya 2005). A. rivularis is found in rivers, lakes, reservoirs, canals, and marshes. It keeps to the water surface in stagnant waters and inhabits the shallow zones of lentic rivers, lakes and ponds with sandy or muddy bottoms.",2,"A. rivularis competes with native species, and has displaced native species in Central Asia. It probably hybridizes with the native Turkestan gudgeon (Gobio gobio lepidolaemus) (Mitrofanov et al., 1988).",1,"A. rivularis is considered as a pest in fish farms where it competes with commercial species for food.",7,"Yes","No","Yes","unclear if it could survive in our climate based on the species temperature tolerance","Abbott's rivulus","Fish",NA,"Yes","Yes","No","No","No","No","Yes","Yes",NA
"2","American Skunk Cabbage","Lysichiton americanus","Araceae",1,"While the species is considered invasive in the EU, it is native to the west coast of N America and has not shown a propensity to further its range. It's not a very popular plant for water gardens because of it's noxious smell.",1,"This species has not shown to colonize much beyond it's native range in BC and the western USA, therefore it is not considered a threat to high value habtiat in Canada.",1,"No indication of strong impacts on native plants except for its large leaves potentially causing issues with sun penetration to lower levels",2,"If it becomes established as a monoculture (has potentially happened in Europe apparently), it can have detrimental effects on the overall ecosystem but these reports of it happening are unconfirmed and may not actually have occurred. It also has particularly deep rhizomes which can make management difficult.",5,"No","No","No",NA,"American Skunk Cabbage","Plant",NA,"No","No","No","No","Yes","Yes","Yes","No",NA
"3","Amur pike","Esox reichertii","Esocidae",1,"Only one report of intention introduction in Pennsylvania, which is considered not-established (Fuller 2022).",1,"not yet found outside of native range.",1,"No data available that suggests this species has established outside of native range. Therefore, little information available on impacts.",1,"same as previous responses",4,"No","No","No",NA,"Amur pike","Fish","USFW, USGS","No","No","Yes","No","No","No","uncertain","uncertain",NA
"4","Amur river clam","Potamocorbula amurensis","Corbulidae",3,"Corbula amurensis larvae were shown to be pelagic for 2-3 weeks in the laboratory (Nicolini and Penry, 2000) and Thompson et al. (2008) show that this is sufficient time for larvae produced in the northern estuary to transit the 40 plus km and settle in the southern estuary. The species may  also be spread through ballast water.",3,"Potamocorbula amurensis have been observed in all habitats except epifaunal (i.e. attached to hard substrate) habitats in the SFE. They prefer mid-intertidal to subtidal ranges but large populations can be found in the high intertidal. Individuals have been collected in silt, clay, hard-pack clay, sand, gravel, peaty mud and shell hash.",3,"Potamocorbula amurensis has eliminated the appearance of two bivalves that used to invade the mesohaline (salinity of 5-18) portion of the estuary during dry and wet periods. Species ability to rapidly increase ppulation size and their ability to filer zooplankton out of the water have been hypothesized to have caused or contributed to a shift in foob webs. There has been a reduction in zooplankton and mysid shrimp concurrent with the invasion of P. amurensis, both of which are important prey for larval and adult fish.",3,"hypothesized to have altered food webs through competition for resources with natiev fish species",12,"yes","No","no","present in ""high intertidal"" is that considered close enough to freshwater to be included in this list of species?","Amur river clam","Mollusc","NIMBUS","No","Yes","No","Yes","Yes","No","Yes","Yes","salt water?"
"5","Amur sleeper","Perccottus glenii","Odontobutidae",3,"This species has a predicted to be introduced to the Great Lakes either through ballast water transfers, use as bait, pond stocking, or aquarium releases (Baker et al. 2022). The species has been reported as invasive in multiple European countries with similar climates to NS (Baker et al. 2022). Although this species is unlikely to be introduced to Maritimes through ballast water, it is possible that these introduction occur through aquarium release. Once established, the species spreads widely through connected watersheds and can spread further during high-flooding events.",3,"This species is highly tolerant to a range of environmentals thresholds, including brackish environments, water bodies that have low dissolve oxygen ocncentration, and eutrophic or near-eutrophic systems (Baker et al. 2022). P. glenii would be particularly impactful on SARA listed and COSEWIC lsited species that are small-bodied fish such as Atlantic whitefish, Lake Utopia rainbow smelt, and red-sided dace.",3,"P. glenii has a high fecundity for a nest-gaurding fish, which increases their reproductive success and can result in monospecific fish communities (Baker et al. 2022; Kutsokon et al. 2021). Morevoer, P. glenii is a parasite host for a number of parasites (listed in Baker et al. 2022). These non-native parasites' range expansions have been linked to the range expansion of this fish in Europe. Also, P. glenii reduces the feeding rate of native species through agressive copmpetition. P. glenii consumes relative large portions of benthic macroinvertebrates, leading the slowed growth and population declines of native species. Lastly, P. glenii has been linked with population declines of multiple native fish species (Baker et al. 2022).",2,"Litertaure of modifications to ecosystem function were not located for this assessment. However, my expert opinion is that P. glenii is likely to alter ecosystem functioning through shift in foodweb structure.",11,"Yes","No","Yes","Should conduct a detailed-level risk assessment to predict areas mostly at risk of introduction.","Amur sleeper","Fish","USFW, USGS","Yes","No","No","No","Yes","Yes","Yes","Yes",NA
"6","Annual Beardgrass","Polypogon monspeliensis","Poaceae",1,"Widespread throughout NA and the world, this species does not seem to have a propensity to invade further than it has. It is not a common",1,"Rabbitsfoot grass prefers moist to wet conditions, including meadows, streams, ponds, lakes, ditches, seasonally wet locations, and disturbed sites. The grass is adaptable and found in a wide range of conditions including saline soils and brackish waters at elevations between 100-8200 feet. (It can't really affect waterways)",2,"As an exotic annual species, rabbitsfoot grass can form dense stands that outcompete native plants and limit their reproduction. Seeds can germinate while still attached to the parent stem.",1,"Typically restricted to moist areas where it can form dense stands and outcompete native vegetation.",5,"No","No","No",NA,"Annual Beardgrass","Plant",NA,"No","No","No","No","Yes","Yes","Yes","Yes",NA
"7","Arctic grayling","Thymallus arcticus","Salmonidae",1,"The species can be found in Northern Canada and Western US, but is unlikely to find suitable habitat in Atlantic Canada due to the preferrence for cold, clear, deep lakes at higher altitude. The only known establishments of T. arcticus are where humans have intentionally stocked the species (Fuller et al. 2022).",1,"Unliekly to become established in Maritiems due to habitat preferences. However, if introduced and successfully established, some inter-species competition would be expected.",2,"If introduced and established T. arcticus would likely be prey upon by trout and salmon (Cutting et al. 2016).",2,"Possible to have some impacts on food webs due to predation on tourt and salmon.",6,"No","No","Yes","What is this species ability to establish in non-alpine environments?","Arctic grayling","Fish","USFW, USGS","No","No","Yes","No","No","No","Yes","uncertain",NA
"8","Arrowhead","Sagittaria sagittifolia","Alismataceae",2,"Although it is widely considered to be a weed of natural, anthropogenic and agricultural systems, there is little information about its specific impact. A recent weed risk assessment for this species rates it as having a high risk of becoming weedy or invasive in the United States. Sagittaria sagittifolia is regarded as having a medium to high risk of introduction due to its use as food or as an ornamental",2,"This species could definetly colonize areas of high value if allowed to invade. Instances of it happening around the world have been documented.",2,"Known to compete with native species, but not much documentation on this subject.",2,"Sagittaria sagittifolia can produce masses of underwater vegetation that could interfere with water flow. It can overgrow small ponds and detrimentally affect the oxygen regime. Forms floating mats, blocking irrigation ditches, shallow dams and waterways.",8,"Yes","Yes","No",NA,"Aarowhead","Plant",NA,"No","No","No","No","Yes","Yes","Yes","Yes",NA
"9","Asian clam","Corbicula fluminea","Corbiculidae",3,"This species is widely distributed throughout North America and can inhabit both freshwater and brackish water ecosystems. There exist multiple vectors for primary introduction including human consumption, use as feed for aquaculture, aquarium release, use as fish bait, bilge water transfers, and biofouling. The species has cause considerable damage to infastructure. Additionally, this species is able to disperse naturally via water currents (Foster et al. 2022; Sabapathy Allen 2019).",2,"This species prefers finer sediments such as fine sand, oragnically-enriched fine sand, coarse sand, and gavel (presumably small-size gravel)(Sabapathy Allen 2019). Therefore, although not all Maritime lakes would offer such fine sediments, many areas where native bivalves are established would be equally suitable for C. fluminea. This would be particularly important to preventing this species introduction to yellow lampmussel and brook floater mussel habitat. Additionally, low pH in Southern and Central Nova Scotia may limit the species establishment.",2,"This species ecosystem impacts are similar to that of zebra and quagga mussels, with very high filtration raates per biomass. Light penetration is an expected outcome post -establishment, as are foodweb shifts and increased macrophyte growth. Also, nutrient cycling may be impacted by shfits in nitrogen and phosphorous cycling and increased bioturbation from bivalve movement  (Sabapathy Allen 2019). However, these impacts would be restricted to areas where the species is able to become established.",3,"In areas where the species is able to established, it is expected that those eocsystems would be greatly impacted. Specific eocsystems functions expected to be impacted by C. fluminea include nutrient cycling, plant growth, food web structure, light interception, and changes in ecosystem composition (Sabapathy Allen 2019).",10,"Yes","No","Yes","Should conduct a detailed-level risk assessment to predict areas mostly at risk of introduction.","Asian clam","Mollusc","AISR, USGS","No","No","No","Yes","Yes","No","Yes","Yes",NA
"10","Asian Semele","Theora lubrica","Semelidae",3,"T. lubrica has shown a wide capacity to colonize other geographical regions and has a quickly reproducing population. Shipping activity is the most likely pathway of introduction of this alien species in the new settlements. Spawning and recruitment occur year-round and the species is highly opportunistic and tolerant of poor water quality.",2,"bays, basins, ports and harbours. In these ambient conditions, it lives on the surface of subtidal soft-bottoms",1,"Ecological impacts are not clear, because it is an opportunistic colonizer of highly disturbed environments, where much of the native fauna has been extirpated",1,"Ecological impacts are not clear, because it is an opportunistic colonizer of highly disturbed environments, where much of the native fauna has been extirpated. Suspected to impact successional patterns.",7,"Yes","No","Yes","Science advice on its impacts would be beneficial to support listing this species. This species does not inhabit freshwater habitats, only marine.","NA","Mollusc",NA,"No","Yes","No","Yes","Yes","No","uncertain","Yes","Appears to be a marine species"
"11","Asian skunk cabbage","Lysichiton camtschatcensis","Araceae",2,"Seeds may be dispersed via waterways but also probably by birds and mammals, as occurs in the native range.",3,"appears to be a wetland plant also capabale of growing in wet soil of riparian zones",0,"d.d.",0,"d.d",5,"No","No","No","American Skunk cabbage (Lysichiton americanus) is known to be invasive,  but Asian Skunk cabbage is not.","Asian skunk cabbage","Plant",NA,"No","No","No","No","No","Yes","Yes","Yes",NA
"12","Asp","Leuciscus aspius","Cyprinidae",2,"This species has been intentionally and illegally introduced for recreational fishing throughout Europe. Like many riverine fish species, L. aspius migrates throughout systems seasonally (Pfauserova et al. 2019). However, L. aspius has notable difficulty in establishing successful populations when introduced (Copp & Godard 2011).",2,"Much of the species' occurrence records from iNaturalist suggest that it may find suitbale habitat in Nova Scotia, which would then impact juvenile salmon, Atlantic whitefish and other small-bodied fish in Canada. L. aspius is a piscivore (Copp & Godard 2011).",2,"Some adverse impacts to ecosystem community would include predation on medium- and larger-size fish by L. aspius and predation on crustaceans, benthic organisms, terrestrial and aquatic insects, and larval fish Copp & Goddard 2011). The exact impacts of asp are unknown as there is little literature available on this species.",2,"The species may cause some local-scale ecosystem functional impacts through foodweb shifts, but again little is known on how/if this species would establish in Maritimes or the species' impacts.",8,"Yes","No","Yes","How likely is this species to establish if introduced?","Asp","Fish","USFW, CABI","No","No","Yes","No","No","No","Yes","uncertain",NA
"13","Australian swamp stonecrop","Crassula helmsii","Crassulaceae",3,"The trade and potential escape through the aquarium and water garden industry; dispersal of disseminules by water currents, often found as a ‘contaminant’ or ‘hitchhiker’ plant with other species ordered through water garden catalogues.  The transportation of this plant on recreational equipment or by wildlife moving between water bodies plays a role in local spread. Can take on various growth forms depending on prevailing conditions, and is able to act as a submerged, emergent, or semi-terrestrial species. A highly competitive plant which is capable of rapid growth and spread",3,"C. helmsii inhabits lakes (area of high conservation value), ponds, gravel pits, inland and coastal wetlands, marshes, swamps, rivers, canals, and irrigation ditches. It colonizes waters ranging from acidic to alkaline, and has also been recorded in semi-saline water bodies",3,"C. helmsii has the ability to form dense stands of 100% cover, which cause many negative environmental and economic impacts including displacing native plant species, In the locales to which it has been introduced, it has often become the dominant plant species, outcompeting natives and displacing other species. A thin covering of C. helmsii can cause significant germination suppression in some plant species. Dense mats suppress native flora and create a poor ecosystem for invertebrates, amphibians, and fish. Decomposing mats of C. helmsii also have the ability to cause fish kills by creating severe fluctuations in dissolved oxygen levels in the water",3,"Reduces biodiversity, decreases water quality, reduces water flow and functioning of flood-control systems, can decrease oxygen levels by limiting water circulation and increasing decomposition of dead plants",12,"Yes","No","No","Sufficient data exists on the impacts of this species and to justify listing.","Australian swamp stonecrop","Plant",NA,"No","No","No","No","Yes","Yes","Yes","uncertain",NA
"14","Austrian yellowcress","Rorippa austriaca","Brassicaceae",2,"Can be severely weedy, and is classified as a noxious weed in several western states. Contamination of agricultural seed, which may in part account for its rapid spread in agricultural regions. Clonal growth, spread by lateral roots, regeneration of root fragments. Reproduction in Rorippa austriaca is usually vegetative, with the plants concentrating their growth 
in belowground tissue and spreading clonally, forming dense patches (CABI, 2019). Root fragments are capable of growing new plants, and Dietz et al. (2002) have described regeneration from root fragments in field studies as “100% successful”.",2,"grows in wetland-riparian or moist areas including roadsides, fields, pastures, marshes, ditches, floodplains, lakeshores, and mud flats between 100-1900 meters (m) above sea level",3,"Disrupts and outcompetes native plant communities.  Impacts threatened or endangered species by disrupting critical 
habitats. Invades pastures and cultivated fields and competes with desirable forage",3,"Reduces biodiversity, colonizes disturbed habitats and alters ecosystem function",10,"Yes","No","No","There is sufficient scientific evidence to support listing and to understand ecosystem impacts.","Austrian yellowcress","Plant",NA,"No","No","No","No","No","No","Yes","Yes",NA
"15","Awl-leaf arrowhead","Sagittaria subulata","Alismataceae",2,"Aquarium trade; fast grower, spreading through runners and forming a dense carpet. Considered invasive in Great Britain and Indonesia",3,"Brackish or salt marshes and flats, floodplain (river or stream floodplains), fresh tidal marshes or flats, shores of rivers or lakes",1,"Lacking data but presumably will outcompete native plant species due to its aggressive growth patterns",1,"Lacking data but presumably will reduce biodiversity by forming monocultures",7,"Yes","Yes","Yes","Insufficient data on ecosystem impacts and species impacts. Would benefit from further science advice as it seems like a potential candidate for listing","Awl-leaf arrowhead","Plant",NA,"No","No","No","No","Yes","Yes","uncertain","uncertain","Ideal temperature range between 20 – 27 °C (68 – 82 °F), but is said to tolerate lower water temperatures"
"16","Bahiagrass","Paspalum notatum","Poaceae",3,"Used as forage, for erosion control and as an ornamental and lawn grass. Aggressive nature also makes it difficult to control as a weed in the landscape. Most commonly used as a pasture species, but can be used for hay production, erosion control, and wildlife habitat. A deep-rooted, sod-forming species that is well adapted to a wide range of soils and conditions in this region. It spreads by short, stout stolons and is a prolific seed producing plant. Was introduced into the United States from South America in the late 1930s (probably in ballast discarded from ships visiting the port at Pensacola, Florida)",2,"dry habitats, moist grasslands, wetlands, disturbed sites, shrublands, forest edges, open ground, savannas, roadsides, irrigation channels, and active and abandoned pastures at elevation from near sea level to 2000m.  It is often planted in gardens and lawns in parks and recreational areas, and can be a weed in fields and plantations",3,"Once established it grows forming dense mats of stolons, rhizomes and a thick root system that inhibit the growth and establishment of other plant species. It is very persistent and competitive, and tolerates drought, sporadic flooding, and continuous grazing; it has the potential to continue dominating pastures decades after abandonment. In the United States, Paspalum notatum is inhibiting the natural restoration of native pine forests across the southern states. Native forests of Pinus palustris and Pinus elliottii are generally able to re-establish in abandoned pastures following cultivation or grazing, but the presence in these pastures of Paspalum notatum and its extensive and dense mat of roots and rhizomes inhibits forest regeneration.",3,"Habitat alteration, monoculture formation, negatively impacts agriculture, reduced native biodiversity, threat to/ loss of native species",11,"Yes","Yes","Yes","While there is sufficient data on the impacts of this species, Science advice would be beneficial on whether this species could successfully establish in our regions in future climate projections.","Bahiagrass","Plant",NA,"No","No","No","No","No","Yes","uncertain","Yes","Tolerates warm average temp. > 10°C, Cold average temp. > 0°C"
"17","Big-eared radix","Radix auricularia","Lymnaeidae",3,"This species is likely to be introduced through aquarium releases and may be found on aquatic plants. The species is widely distributed through Europe, Western US, and southern BC. A few isolated populations have been identified in the Great Lakes and St. Lawernece River (see iNatrualist; Kipp et al. 2022).",2,"Given that many areas of conservation concern (e.g. SAR habitat, potential ESAs) are further away from cities and, therefore, less likely to have aquarium releases, the likelihood of R. auricularia introduction to conservation areas is low. However, Blackettes Lake in Cape Breton may be one cite where there is suitable habitat, pet stores nearby, and a lake identified for conservation concern.",2,"The main concern with this species introduction is the potential to transmit parasites (Kipp et al. 2022). Yet, the CFIA biosecurity controls for parasite and disease in aquarium animals is likely to limit commerically available snails to host parasites (although, this is an assumption).",1,"no data is available that suggested this species impacted ecosystem function.",8,"Yes","No","Yes","Is this species likely to cause native species or ecosystem function impacts if introduced?","Big-eared radix","Mollusc","AISR, USGS","Yes","No","No","Yes","Yes","No","Yes","Yes",NA
"18","Bighead carp","Hypophthalmichthys nobilis","Cyprinidae",3,"Similar to silver carp, H. nobilis is primarily introduced as a biocontrol for algal growth in aquaculture sites from which the species later escaped and continued to spread throughout connected systems (Fuller et al. 2024). Interesting, the species may also be desirable for garden/city ponds, also as a biocontrol (Fuller et al. 2024). The species is expected to become widely spread if introduced to either aquauclture or garden/city ponds as is evident from the wide distribution throughout the US river systems.",3,"H. nobilis is present in numerous freshwater habitats and has established reproductive populations where introduced in the US, including the northern states (Fuller et al. 2024). Therefore, it is excepted that the species could establish in freshwater systems in the Maritimes if introduced including within areas of hihg conservation value.",2,"The impacts of H. nobilis are not well studied but there is some evidence suggetsing that this species (similar to other invasive carps) would impact plankton populations, which impacts larval fish, mussels, freshwater clams, and other native planktivorous species. Additionally, H. nobilis may impact paddlefish, bigmouth buffalo, and gizzard shad through overlapping diets (Fuller et al. 2024).",2,"This species high fecundity could contribute to increased inter-species competitions with other native fish species leading to food web shifts, changes in native species behaviours, and declines in plankton abundance (Fuller et al. 2024).",10,"Yes","No","Yes","More research is needed on inter-species competition to better determine the direct and indirect impacts of H. nobilis.","Bighead carp","Fish","AISR","No","Yes","No","No","No","Yes","Yes","Yes","Does not have a climae match assessment"
"19","Bigpod sesbania","Sesbania herbacea","Fabaceae",0,"not frost tolerant",0,"not frost tolerant",0,"not frost tolerant",0,"not frost tolerant",0,"No","No","No","does not tolerate forst, likely not able to survive in our climate","Bigpod sesbania","Plant",NA,"No","No","No","No","No","Yes","Yes","Yes","*may not be able to survive in our climate"
