"","species_common.x","species_latin","Family","Qu.1","RationaleQu1","Qu.2","RationaleQu.2","Qu.3","RationaleQu.3","Qu.4","RationaleQu.4","Global environmental risk","AISR_Listing","Secondary_Assessment","Science_Support","Notes.x","species_common.y","taxa","listed_elsewhere","pet_aquarium","Aquaculture","rec_fish","biofouler","Bilge Water","water_garden","possible_to_overwinter","suitable_hab_suspected","Notes.y"
"104","Hyssop loosestrife","Lythrum hyssopifolium","
Lythraceae",1,"Salisbury (1968) estimated that individual plants have an average output of 3200 seeds, but this varies greatly between plants and years. For example, large individuals can produce up to 75 000 seeds. The seeds do not become viscid when wet. However, waterbirds are important dispersal vectors, since the seeds collect on the mud of birds’ feet. Also, ingestion and subsequent voiding of seeds may be an important dispersal mechanism, although the viability of such seeds is unknown. Dry seeds shed upon water will float but, when wet, they sink so that local dispersal is perhaps largely by rain wash (Salisbury 1968).      In Britain, L. hyssopifolium has been described as well established in arable fields since the early 17th century (e.g. Gerarde 1633; Merrett 1667) but has frequently occurred as an alien, usually via imported grain (Preston & Whitehouse 1986).",3,"Brackish or salt marshes and flats, dunes, marshes, wetland margins (edges of wetlands)",1,"As a ruderal species, L. hyssopifolium is highly competitive during the early stages of succession but lacks long-term competitive ability. The principal competitive methods are high seed productivity in relation to the size of the plants, and rapid germination and completion of the life cycle when favourable conditions arise (Salisbury 1970; Preston & Whitehouse 1986).",0,"d.d.",5,"No","No","No","present (native?) to the New England states","Hyssop loosestrife","Plant",NA,"No","No","No","No","No","Yes","Yes","Yes",NA
"105","Inland silverside","Menidia beryllina","Atherinopsidae",3,"Although the species has not been widely introduced, it has spread throughout river systems where itroduced. The primiary pathway of introduction is stocking for various reasons, the main one being to create a forage species for sport fish. Species quickly reproduces in suitable habitat. However, some population have died-out due to harse winter conditions Fuller et al. 2022).",3,"This species has been linked with declines in native fish species and has been introduced to multiple areas of conservation concern for either ecological or economic purposes (Fuller et al. 2022). Since the species' introduction mainly occurs through intentional transfers for stocking forage fish species, the introduction of this species may be limited in NS to areas with a high proportion of recreational angling. One note of concern for Maritimes region (Science boundaries, not AIS NCP boundaries), is the expected impact of M. beryllina on smelt and stripped bass. Both rainbow smelt and stripped bass are species of conservation concern in Maritimes. Furthermore, other small-bodies fish such as Atlantic whitefish would be at risk of impact.",2,"M. beryllina impacts fish food webs by excerting inter-species competition pressures on small-bodied fish and juvenile fish. This has lead to the extinction and decline of brook silverside, hitch, Sacramento blackfish, Clear Lake splittail, bluegill, and may impact black and white crappies, Dealta smelt, and juvenile striped bass (Fuller et al. 2022).",2,"The species' impact on ecosystem functioning is not well understood, but it is likely that this species would indirectly impact ecosystem functions based on shifts in food web dynamics.",10,"Yes","Yes","Yes","Unknown if the species would become well established. Prehaps there is a thermal range limit that is not currently noted here or in Fuller et al. (2022)?","Inland silverside","Fish","USFW","No","Yes","Yes","No","No","No","Yes","Yes",NA
"106","Jaguar guapote","Parachromis managuensis","Cichlidae",1,"Despite this species readily available in the aquarium industry, it is likely that the P. managuensis would be limited in range due to thermal limits. This species is indigenous to tropical America, but has been introduced throughout US. P. managuensis is established in southern US in Florida, Louisiana, Hawaii, and Nevada; formaly established in Utah but may have been eradicated (Nico et al. 2022). Therefore, the species may be introduced to more northern ranges (e.g. Utah) but the ability of the species to be established long-term is likely limited.",1,"Likely limited range expansion based on water temperature. Therefore, if the speces was introduced it could only survive in areas of artifical warmth (Nico et al. 2022).",1,"Not enough data on the species to determine impacts on invaded ecosystems, especially since establishment is typically temporary (Nico et al. 2022).",0,"d.d.",3,"No","No","No","No need for further research. However, I recommend reading the species USGS page remarks. Apparently, the US cowboys tried to eradicate the species with rotenone and explosive, which was a failed attempt. Lol","Jaguar guapote","Fish","USFW","Yes","No","No","No","No","No","No","No",NA
"107","Japanese mitten crab","Eriocheir japonica","Varunidae",0,"No data available on this species in the invasive range. Current range on iNaturalist seems restricted to native range, but CABI indicated potential introductions to US and Australia.",0,"d.d.",0,"d.d.",0,"d.d.",0,"No","No","Yes","Prehaps a CSAS to assess risk of freshwater and esturine non-indigenous crabs to Canada?","Japanese mitten crab","Arthropod","USFW","No","Yes","No","No","Yes","No","Yes","Yes",NA
"108","Kashmir balsam","Impatiens balfourii","Balsaminaceae",2,"Balfour’s balsam is commonly planted in gardens as an ornamental. Its pretty flowers and easy maintenance make it a popular plant for shady, wet areas. However, it can quickly escape gardens and infest wetlands. Seed pods form late summer to early fall. When disturbed, these pods can launch seeds up to 20 feet (6 meters). Seeds can be carried by water.",3,"It grows in forest understories, riparian areas, and wetlands. It prefers shady areas with damp to wet soil conditions.",2,"It can rapidly spread across riparian areas, outcompeting native plants for light, nutrients, soil, and space.",3,"The shallow root system does not hold soil intact and can cause erosion along stream banks and rivers.",10,"yes","yes","no",NA,"Kashmir balsam","Plant",NA,"No","No","No","No","No","Yes","Yes","Yes","Annual plant"
"109","Killer Shrimp","Dikerogammarus villosus","Gammaridae",3,"This species is noted as highly invasive in Europe. It is possible that D. villosus would be introduced to the Great Lakes in Canada via ballast water transfers, from which point the species could spread to other provinces. It is unlikely that a primary introduction to NS via ballast water would result in establishment. However, the species may survive brackish conditions and so, introductions to the upper St. Lawerence would also be concerning. Furthermore, this species naturally migrates and may spread up to 40km/year (Mastitsky 2009).",3,"Due to the species ability to under take long mitgrations, it is expected that afetr an initial introduction D. villosus would continuously spread in NS (and throughout Canada) (Mastitsky 2009). D. villosus may hitchhike on fishing gear or unclean boats to new water bodies and become established.",3,"This species is an aggressive predator of invertebrates, amphipods, fish eggs, and even larval fish. Additionally, D. villosus can filter feed on microalgae. D. villosus presence significant alters food webs through a bootom up approach and may even lead to extinction of some native amphipods.",2,"Because D. villosus frequently disrupts food webs and completely replaces both native and non-native amphiods, it is likely that the species impacts on ecosystem function are irreversible. However, no literature was located in this assessment that specified this.",11,"Yes","No","No",NA,"Killer Shrimp","Arthropod","OISC, NOAA","No","No","No","Yes","Yes","No","Yes","Yes",NA
"110","Knotgrass","Paspalum distichum","Poaceae",1,"A common weed of rice paddies and fields in tropical and sub temperate areas, this grass has poor growth below 10 degrees, and will not sprout below that temperature as well. Unlikely to have strong invasiveness in NS",2,"This species is known to colonize high value habitat, and is indiscriminate in doing so. While unlikely to occur along NS waterways, it does have potential.",2,"This species can outcompete others for space, and is known to harbour some pests of other forage crops. Can cause issues with monoculture.",2,"This species can alter water flow and can outcompete native species causing issues with monoculture. Also known to increase mosquito populations than more open vegetation, which can then indirectly increase disease risk.",7,"Yes","Yes","Yes","A CSAS question around the possibilty of sub-temperate weeds of marshes and swamps might be prudent. There are several on the list.","Knotgrass","Plant",NA,"No","No","No","No","Yes","Yes","Yes","Yes",NA
"111","Kutum","Rutilus frisii","Cyprinidae",1,"No resources were located that suggested that this species was 'invasivs' or 'exotic' or even likely to be introduced outside its native range (where it is endangered). FishBase does have a species page noting the species wide environmental tolerances to freshwater and saline (diadromous species) and the migratory behaviour of the species.",1,"See previous section. Seems unlikely that this species would be introduced.",1,"No adverse ecosystem impacts were noted on FishBase.",1,"same as before.",4,"No","No","No","This species is listed under Part 2, but it is not a prioritiy species given how restricted it is.","Kutum","Fish","AISR, FB","No","Yes","No","No","No","No","uncertain","uncertain",NA
"112","Lake Trout","Salvelinus namaycush","Salmonidae",3,"Fast swimming, able to travel many kms",3,"prefers to live in cold deep lakes",3,"Lake Trout often lead to the demise of other trout species where it is introduced. Lake trout have caused localized extinctions of cuthrout  and bull trout populations throughout the United States.",2,"Lake trout can impact food webs but removals of the species have resulted in restoration of native ecosystem structure in locations where this has been attempted.",11,"yes","no","no",NA,"Lake Trout","Fish",NA,"No","No","Yes","No","Yes","No","Yes","Yes",NA
"113","Largemouth bass","Micropterus salmoides","Centrarchidae",3,"Research of natal and intergenerational dispersal of M. salmoides is estimated between 7.7-8.3 km from natal tributary, which is greater than estimated for Smallmouth bass (M. dolomieu) that has already become widely distributed throughout Nova Scotia (both through illegal angler introductions and natural dispersals) (Humston et al. 2021). Previous DFO risk assessments noted that some Canadian introduced populations, in southern British Columbia, are thought to have naturally spread.  from other illegally introduced populations from the USA (Brown et al. 2009). Thus, confirming that M. salmoides is able to naturally disperse over relatively large geographic areas (large for a lotic, residental fish).",3,"M. salmoidea has become widely established through all of the U.S. (expect Alaska), southern Canada, parts of Western Europe, South Africa, and Eastern and Central Aisa (Brown et al. 2009; Fuller et al. 2023; iNaturalist).  Fuller et al. (2023) noted that M. salmoidea introductions in the U.S. have resulted in reduced abundance and diversity of native prey species, some of which species were potential driven to extinction.",3,"Since there are no similar fish predators native to Nova Scotia, it is likely that M. salmoidea introduction would lead to local extinctions and/or significant declines in abundance and diversity of the region's native dace, stickleback, and other small-bodied species (Fuller et al. 2023). Furthermore, M. salmoidea introduction may be a tipping point for already vulnerable species including Lake Utopia rainbow smelt, Atlantic whitefish, and Atlantic salmon (all DUs).",2,"More research is needed to determine how M salmoidea introduction would impact Nova Scotian habitat, but it is my professional opinion that there would be significant impacts on food web structure.",11,"Yes","No","Yes","This species could be included in a future detailed-level risk analysis to determine where suitable habitat exists, overlaps with SAR and other vulnerable species, socio-economic impacts. Specifically, I'm curious about how species such as M. salmoidea (and others) that have no native equivalent in NS would impact the native ecosystems here. Would these effects be reversible?","Largemouth bass","Fish","AISR","No","No","Yes","No","No","No","Yes","Yes",NA
"114","Longear sunfish","Lepomis megalotis","Centrarchidae",2,"There is not much literature available on this species. However, Previous reports can confirm that the species is/was present in southern Ontario (Gruchy & Scott 1966). Others report that the species' distribution is restricted or scarece (Cornell University n.d.) or that the species distribution is wide spread (e.g. from southern QC to northern Mexico) but also restricted (Fuller & Cannister 2023; Texas Parks & Wildlife n.d.).",1,"Based on the limited information available, it seems that L. megalotis is restricted to areas were introduced and does not become widely established after introduction. Fuller & Cannister (2023) hypothesis that the species may not widely spread due to avoidance of fast-flwoing water.",1,"No adervse impacts to native species have been reported. Notably, the literature on this topic is limited.",1,"This is generally unknown. Nova Scotia does not have many native sunfish species. Therefore, this species could be a potential threat depending on whether it can establish, similar native species, position in trophic structures, etc.",5,"No","No","Yes","Due to the species low rate of introduction, this species is categorized as low priority. However, the lack of information around this species may indicate gaps in our management plans that could lead to larger introductions and issues.","Longear sunfish","Fish","AISR, USGS","No","No","Yes","No","No","No","Yes","Yes",NA
"115","Longnose gar","Lepisosteus osseus","Lepisosteidae",2,"Based on the limited species distribution maps available, it seems that L. osseus occupies a range from the St. Lawerence river to Florida (iNaturalist; Goddard 2021). There were no data available on the annual rate of spread by this species, but the Floirda Museum of Natural History (Goddard 2021) noted that the species routinely migirates up streams for spawning.",2,"It is unclear if L. osseus is currently introduced and established outside its native range. However, the species may compete with Atlantic salmon for spawning habitat. Furthermore, this species can inhabitat areas of low DO and moderate (brackish) salinity concentration (Goddard 2021).",2,"The impacts of L. osseus impacts on vulnerable species or areas of conservation value is largely under reported. Therefore, further research would be needed to properly assess this. However, based on the information available from Goddard (2021) the species may compete with Atlantic salmon for spawning habitat and Brown bullhead as a prey species.",2,"Due to the species unqiue physicology, it is expected that there would be some impacts to food web structure but those impacts may be local.",8,"Yes","No","Yes","As this species is native in multiple Canadian provinces, this species should be prioritized for a detailed assessment todetermine if vectors exist to introduce this species (e.g. it is available through aquarium trade), where suitable habiatt exists, and expected impacts on native ecosystems.","Longnose gar","Fish","AISR","No","No","Yes","No","No","No","uncertain","uncertain",NA
"116","Long-snouted prawn","Palaemon longirostris","Palaemonidae",2,"P. longirostris appears to have spread over to the Crimean coasts as a result of migration through the straits from the Mediterranean Sea, where it is common. Such migrations are among the most common vectors of alien species entry to the Black Sea. It is conceivable that the planktonic larvae and juvenile shrimp penetrated to the Black Sea with ballast waters, inasmuch as the shrimp was found in the immediate proximity to the Sevastopol port area.",3,"P. longirostris is a coastal species that occurs from the water’s edge to the depth of 17 m. Some literature sources point out that it inhabits the shallow-depth limans, featuring a wide range of salinity, and prefers brackish waters of the estuarine ecotones (Van Den Brink and van Der Velde, 1986). According to other sources, it lives in fresh water, but migrates to brackish waters of deltas to spawn (Grabowski, 2006). Its development occurs in estuarine zones of the river drainage systems throughout all larval stages. Seven zoaea stages have been described in the species.",0,"d.d.",0,"d.d.",5,"No","No","Yes","considered invasive in the Black Sea","Long-snouted prawn","Arthropod",NA,"No","Yes","Yes","No","No","No","Yes","Yes",NA
"117","Mannagrass","Glyceria declinata","Poaceae",1,"Plants are often mistaken for other rye grasses, and this can sometimes lead to further range expansions. A lot of conversation about their impacts on vernal pools which is beyond the purview of DFO and this study.",1,"This species could be managed withboth mechanical removal and herbicides if there were indications that it was encroaching on areas of high value. As a terrestrial plant that just tolerates flooding, it is unlikely to affect aquatic environments in any long lasting capacity. THis particular species is noted for having small seeds that could be transported via waterfowl.",1,"Can sometimes outcompete natives, but usually only because the environmental conditions have changed to beenfit the invader (i.e. area becomes very wet for a short period of time).",1,"Can compromise the integrity of small pools and threaten endemic and endangered plants - but only uynder certain ideal conditions.",4,"No","No","No",NA,"Mannagrass","Plant",NA,"No","No","No","No","No","Yes","Yes","Yes",NA
"118","Marbled crayfish","Procambarus virginalis","Cambaridae",3,"P. virginalis is parthenogenetic and, therefore, there is a high risk of any P. virginalis introduction to result in an established populaiton. Additionally, P. virginalis is known for wondering and spread between ponds, lakes, etc and other non-connected waterbodies through overland dispersal via walking (U.S. Fish & Wildlife Service 2018).",3,"Although P. virginalis is most likely to be introduced to ponds or lakes, especially in areas close to human populatio centers, the species is able to inhabitat a variety of freshwater habitats. There is some uncertainty around the species  thermal tolerance, some sources claim that the species requires above 14 degrees C for reproduction, but other sources claim that P. virginalis was able to survive in cold water (0-2 degree C) and under ice (U.S. Fish & Wildlife Service 2018). Due to the species only known vector being the pet and aquarium trade, the species is likely to be introdcued to human-made structures (e.g. ponds) and/or human-population centers. However, the species is likely able to spread to high value habitat once introduced.",2,"There is a lack of information on P. virginalis impacts on native species. Anecdotal observations of the species in Madagascar suggest that native fish species populations are quickly decreasing abundance. Additionally, some plant species such as rice paddies, may be impacted by P. virginalis. Lastly, P. virginalis could compete with native crayfish species for food or space and could transfer diseases, such as crayfish plague, to native species (U.S. Fish & Wildlife Service 2018).",3,"If P. virginalis is able to produce dense populations (which may be controled by water temperature thresholds), it is likely that the species will impact ecosystem functioning through shifts in food web structure, increases to inter-species competition, disease transmission, and alterations to physical habitat structure (U.S. Fish & Wildlife Service 2018).",11,"Yes","No","Yes","What are the thermal thresholds for marbled crayfish? Can the species reproduce in the Maritimes?","Marbled crayfish","Arthropod","OISC, NOAA, MS","Yes","No","No","No","No","No","uncertain","uncertain",NA
"119","Mayan cichlid","Mayaheros urophthalmus","Cichlidae",0,"Tropical species",0,"Tropical species",0,"Unlikely to impact species in the Maritimes.",0,"see previous response",0,"No","No","No","unnecessary","Mayan cichlid","Fish","USFW","Yes","No","No","No","No","No","No","No",NA
"120","Mountain hemlock-parsley","Seseli libanotis","Apiaceae",2,"Garden Trade. Invasiveness mentioned in literature but not well documented.",1,"Grassy and shrubby slopes, forest edges, lowlands to subalpine. Does not appear to occupy aquatic or riparian habitat and prefers terrestrial.",0,"D.D.",0,"D.D.",3,"No","No","No","Insufficient data on species and ecosystem impacts, but does not appear to be of concern as the species does not exhibit preference for aquatic or riparian habitat.","Mountain hemlock-parsley","Plant",NA,"No","No","No","No","No","Yes","Yes","Yes",NA
"121","Mozambique tilapia","Oreochromis mossambicus","Cichlidae",1,"Unlikely to become established in Canada due to temperature tolerance limits being ~11 degrees C (Nico & Neilson 2023). However, this species should be re-evaluated in the future.",1,"Unable to become widely established in Canada due to temeprature limits. However, the species could be established in artifically heated ponds or in brackish water that remains ~11 degrees C.",1,"In some southern US states, this species is linked with declines in native fish species (Nico & Neilson 2023).",3,"If established, this species will alter aquatic vegetation, aquatic and emergent insect communities, and benthic interactions (Nico & Neilson 2023).",6,"No","No","Yes","This species' suitable habitat range should be predicted under climate change coniditions to determine if the species could become established in southern Canada.","Mozambique tilapia","Fish","USFW","Yes","Yes","Yes","No","No","Yes","Yes","Yes",NA
"122","Mud bithynid","Bithynia tentaculata","Bithyniidae",3,"B. tentaculata could be introduced to Nova Scotia through the pet and aquairum trade or unclean boats and fishing gear coming from Ontario to Eastern Canada. This species may further spread via hitch-hiking on aquatic macrophytes (especially during the summer), natural spread (species has a high fecundity), or being transported by waterfowl (Kipp et al. 2023).",2,"In Canada, this species seems restricted to the Great Lakes. However, the B. tentaculata seems similar in introduction vector types and habitat preferrences as C. chinensis and thus, may occupy similar locations if it was introduced to NS and/or locations with suitable pH (6.6-8.4) (Kipp et al. 2023).",2,"B. tentaculata is likely to impact native ecosystems through increased inter-mollusc competition for food resources and [Ca] for shell growth. B. tentaculata typical has a faster growth rate than native snail species (Kipp et al. 2023). Furthermore, B. tentaculata host multiple parasites that could have significant impact on Maritime fuana (Kipp et al. 2023).",2,"B. tentaculata may alter food web structures through a bottom-up mechanism by increased comsumption of algae (both benthic and suspended). Furthermore, there is evidence that suggests that B. tentaculata presence decreased abundances of native snail species where introduced and that B. tentaculata often co-occurs with other high profile invaders such as zebra mussel and Eurasian water milfoil, which exaggerated ecosystem impacts further (Kipp et al. 2023).",9,"Yes","No","Yes","A risk assessment for snails from the aquarium trade was already conducted and did include B. tentaculata (Schroeder et al. 2014). However, a systematic review would be more informative on the ecosystem impacts of this species similar to that done for C. chinensis (Kingsbury et al. 2020).","Mud bithynid","Mollusc","AISR, USGS","No","No","No","Yes","Yes","No","Yes","Yes",NA
"123","Mud sunfish","Acantharchus pomotis","Centrarchidae",2,"Except for populations intentally introduced to the Maritimes, it is unlikely that this speces will spread naturally. A. pomotis is likely to find suitable habitat in Nova Scotia, especially in south-Nova where pH is lower, where wetlands and extensive vegatation exist, or where cedar forest exist (Pardue 1993). However, A. pomotis is considered 'Threatened' in its native range and there seems to be few vectors available that would lead to the species initial introduction (i.e. not a popular rec fish, not popular for aquariums or water gardens, and not a bi-fouling species) (New York State Department of Environmental Conservation, n.d.). Some others note the species as extirpated in Pennsylvania and New York; 'vulnerable' in Delaware, Maryland, Virginia, Georgia, and Florida; and 'stable' in New Jersey and North Carolina (Rider & Schell 2012).",1,"Little is known about this species (only 10 references available on Web of Science), but it would seem that this species is difficult to locate within its native range and has not been introduced outside that.",1,"No literature was located in this assessment that indicated A. pomotis has negative ecosystem impacts, likely due to the species being constrained to native ranges.",1,"No literature was located in this assessment that indicated ecosystem alterations caused by A. pomotis.",5,"No","No","No",NA,"Mud sunfish","Fish",NA,"No","No","Yes","No","No","No","Yes","Yes",NA
