"","species_common.x","species_latin","Family","Qu.1","RationaleQu1","Qu.2","RationaleQu.2","Qu.3","RationaleQu.3","Qu.4","RationaleQu.4","Global environmental risk","AISR_Listing","Secondary_Assessment","Science_Support","Notes.x","species_common.y","taxa","listed_elsewhere","pet_aquarium","Aquaculture","rec_fish","biofouler","Bilge Water","water_garden","possible_to_overwinter","suitable_hab_suspected","Notes.y"
"38","Bulltongue Arrowhead","Sagittaria lancifolia","Alismataceae",2,"Recognized as being potentially invasive due to clonal growth (Weber and Gut, 2004). It can grow aggressively, spreading to form large patches of plants which can span slow-moving streams and form solid stands in artificial waterways. In its native range, S. latifolia has been declared an aquatic weed in Puerto Rico (USDA-ARS, 2009) and is recognized in some areas of North America as a weed by the Southern Weed Science Society. S. latifolia is a native species in the N. American continent and is well distributed throughout southeastern Canada and the eastern United States, being the commonest and most widespread species of the genus Sagittaria. The tubers can be dispersed by water in streams and rivers. S. latifolia has been introduced for ornamental and amenity purposes",3,"Forms colonies in shallow waters, in long bands following the curves of rivers, ponds and lakes. It is also found in ditches, in open woodlands that are prone to frequent flooding, in swamps, marshes, bogs, seeps and freshwater wetlands, stream-sides, ditches, floodplains, low-lying areas with wet mud, and the borders of lakes or ponds",2,"Outcompetes native plant species and forms dense monocultures",2,"S. latifolia can spread quickly and occupy artificial channels and drainage ditches. Can cause the modification of successional patterns",9,"No","Yes","No","Sufficient data on the ecosytem impacts, but is considered native in North America so am unsure of candidacy for listing in AIS Regs","Bulltongue Arrowhead","Plant",NA,"No","No","No","No","Yes","Yes","uncertain","uncertain",NA
"39","Butterfly ginger","Hedychium coronarium","
Zingiberaceae",2,"H. coronarium has been widely distributed by man because of its attractive flowers, fragrance and the possibility of other economic uses.  Parts of rhizomes and capsules can float to new locations in water systems.",2,"H. coronarium grows in humus-rich, shaded or semi-shaded areas subjected to waterlogging. It is usually found along water margins and in shallow water but is never totally submerged (Joly and Brandle, 1995).",2,"H. coronarium can dominate other species in waterlogged areas. Under favourable conditions, the plant can form extensive thickets which may suppress the regeneration of native wetland plants.",2,"Under favourable growing conditions, H. coronarium can disturb water flow in channels. It can invade canals, streams and other shallow water areas.",8,"Yes","Yes","Yes",NA,"Butterfly ginger","Plant",NA,"No","No","No","No","No","Yes","Yes","Yes",NA
"40","Carp bream","Abramis brama","Cyprinidae",2,"Little information was available for this species but maybe pictures found through a Google Search of the species name suggested that it may have some recreational or aquaculture values.",3,"A. brama can migration large distances upriver for spawning (e.g. 100 km in Dniepr) (Kottelat & Freyhof 2007 as referenced by Fish Base n.d.). There was a notable lack of literature on A. brama invasions available, but one study (Volta et al. 2013) did note that A. brama contributed to native species declines and, therefore, did impact habitat in southern Europe.",2,"Although no studies were located that focused on A. brama  potential impacts on North American ecosystems if introduced, Volta et al. (2013) noted that A. brama impacted water quality and fish assemblages where introduced in southern Europe. Therefore, it is expected that this species would adversely impact Maritime species if A. brama could establish.",2,"It is currently unknown as to whetehr removal of A. brama would reverse ecosystem impacts, but it is known that A. brama  impacts water quality (Volta et al. 2013).",9,"Yes","Yes","Yes","Uncertainty on species ecological threaholds and potential impacts to Maritimes.","Carp bream","Fish","AISR, FB","No","Yes","Yes","No","No","No","Yes","uncertain",NA
"41","Cave Isopod","Proasellus coxalis","Asellidae",2,"Spread in the inland waters of Europe through inland shipping – as a stowaway in ship’s ballast water. The creation of connecting channels allowed for autonomous dispersal between previously separated river basins. is a poor swimmer and the adults mainly live on the bottom. Therefore, dispersal occurs mainly via juveniles carried away with the currents. As the currents at the sites of occurrence are often slow, dispersal is limited",2,"A freshwater species, it can thrive in brackish water, such as in estuaries. The species can be found at salinities up to 5 PSU",0,"D.D.",0,"D.D. There are no known effects on the ecosystem linked to the occurrence of this isopod.",4,"No","No","Yes","There is insufficient information in the literature on the potential impacts on native species and ecosystem functions of P.coxalis","Cave Isopod","Arthropod",NA,"No","No","No","No","Yes","No","uncertain","Yes",NA
"42","Channel Catfish","Ictalurus punctatus","Ictaluridae",1,"Has been in North America for a very long time and yet has not progressed very far in terms of invasion. Intentional stocking is usually blamed for most invasions.",1,"It has established well in areas of the great lakes where it has been introduced, and it has colonized areas of high value, but the rate at which it is expanding its range dictates the risk of it happening to be low",2,"It is known to prey upon native fish and other smaller species. It can also prey upon crayfish, which may have ancillary benefits in Nova Scotia.",1,"This species does not show extensive alternation of ecosystem function.",5,"No","No","No",NA,"Channel Catfish","Fish",NA,"No","Yes","Yes","No","No","No","Yes","Yes",NA
"43","Channeled Applesnail","Pomacea canaliculata","Ampullariidae",3,"P. canaliculata has many vectors for introductions and spread, but mainly Asian food markets and the pet and aquarium trade are implicated. Once introduced (and if establishment is possible), the species spreads widely and quickly. However, the species temperature threshold limits it's ability to currently establish in Canada as it can withstand temperatures of 0 degrees C for 5-20 days, -3 degrees C for 2 days, and only 6 hours at -6 degrees C. Therefore, it is unlikely to become established in Canada but may establish if water temepratures remain above 0 degrees C (Cowie 2013).",2,"Yes, the species is known to become widely established and significantly impacts areas of conservation value (Cowie 2013).",2,"Not that this has high importance for the Maritimes (because these industries are minimal if existing at all) but this species causes significant damage to paddy crops (e.g. wild rice, water lilies, watercress, rice, etc.). In terms of environmental impacts, P. canaliculata significantly impacts native plant biomass, which results in shifts in nutrient cycling, ecosystem structure , and ecosystem functioning (Cowie 2013).",2,"P. canaliculata impacts ecosystem functioning through biodiversity loss, altering habitat structure, and changes to nutrient cycling (Cowie 2013).",9,"Yes","Yes","Yes","Uncertainty on species ecological threaholds. Would this species survive winters in Canada?","Channeled Applesnail","Mollusc","USFW","Yes","No","No","Yes","No","Maybe","uncertain","uncertain",NA
"44","Checker mallow","Sidalcea malviflora","Malvaceae",2,"Native to western United States. Transported through the garden trade and intentional planting.",1,"coastal prairie, coastal sage shrub, dry open flats, grassland, meadows, woodland and forests (oak, pine, redwood or fir). Does not appear to occupy much riparian or aquatic habitat",0,"D.D. Only data provided is regarding benefits to native pollinators",0,"D.D. Only data provided is regarding benefits to local diversity",3,"No","No","No","Insufficient data on species and ecosystem impacts, but does not appear to be of concern as the species does not exhibit invasive tendencies and is restricted in its native range in the U.S.","Checker mallow","Plant",NA,"No","No","No","No","No","Yes","Yes","Yes","Does not appear to occupy much riparian or aquatic habitat"
"45","Chinese Mitten Crab","Eriocheir sinensis","Varunidae",2,"The most likely pathways are the active transport and voluntary release of mitten crabs into new habitats to provide a new human food source, and the accidental release of crabs via ship ballast water discharge or through hitchhiking on recreational equipment. The species arrived in the great lakes in 2004 but has not expanded much further.",1,"Unless there was a deliberate release into high value habitat, it is unlikely that this species will colonize. There have only been 24 Chinese mitten crabs recorded in the Great Lakes between 1965 and 2007",2,"This species can have direct impacts on freshwater fish, and species at risk by feeding on their eggs (i.e. salmon/trout)",2,"Chinese Mitten Crab have been known to damage fish habitat by causing extensive river bank erosion via their burrowing activities.",7,"Yes","No","No",NA,"Chinese Mitten Crab","Arthropod","AISR","No","Yes","No","No","Yes","No","Yes","Yes",NA
"46","Chinook Salmon","Oncorhynchus tshawytscha","Salmonidae",2,"This is rated as medium risk as there is the potential for human mediated introductions as a sport fish, as well as a narative that the species is native to Canada, but in reality it was introduced over the past century and a half. Many stocking events have also occured.",1,"If introduced this species could colonize high value areas, and potentially distrupt valuable sportfishing industries",2,"Chinook salmon is a predatory fish and as such may impact populations of smaller fish. Some agencies in Lakes Michigan and Ontario drastically reduced their stocking quotas in the 1990's for Chinook salmon and are concerned about their impact on the fish community, namely declining populations of alewife and other forage fish (Schriener 1995). Jones et al. (1993) predicted that maintaining high levels of predator demand by stocking chinook and other top predators at the current rate would eventually lead to an alewife collapse, possibly followed by the further collapse of other small forage fish populations. Chinook had totally eliminated rainbow smelt Osmerus mordax in two small New Hampshire lakes where the salmon was stocked to control the smelt (McAffee 1966).",2,"Through direct and indirect competition this species may disrupt ecosystems and food webs - Scott et al. (2003) found that the presence of chinook salmon causes delayed nesting and reduced survival of Atlantic salmon during spawning in Lake Ontario.",7,"Yes","No","No","Well studied species","Chinook Salmon","Fish",NA,"No","Yes","Yes","No","No","No","Yes","Yes",NA
"47","Climbing Hempweed","Mikania scandens","Asteraceae",2,"Is native to temperate to subtropical eastern North America, considered extirpated in Maine. Risk of introduction of M. scandens is low in the near future since it has no horticultural use at present and does not appear to exhibit extensive long-distance dispersal. M. scandens does thrive in wetlands and can be weedy in areas subject to flooding (Moon et al., 1993), and thus transport of seeds or vegetative plant sections between wetland environments can occur. Seeds can wind-disperse as aided by the pappus on the fruit. Vegetative fragments can be carried by water and form new plants through rooting",3,"stream banks and swamps to 500 m in elevation, coastal wetland areas, restricted to fresh or oligohaline sites where salt concentrations do not exceed 5 ppt",1,"Potential to grow over and outcompete native plant species and is considered allelopathic. Although M. scandens is fairly common in the southern part of its native range in North America, its weediness is only mentioned with respect to wetlands in Florida, such as the banks of the Oklawaha River (Moon et al., 1993).",1,"Lacking data on ecosystem impacts. Most research focuses on the benefits of this species for restoration of marsh communities following removal of Phragmites australis and benefits as a food source for native herbivores.",7,"Yes","Yes","No","Based on current literature this species does not seem to have high risks of invasiveness or very active pathways of dispersal.","Climbing Hempweed","Plant",NA,"No","No","No","No","Yes","Yes","uncertain","uncertain",NA
"48","Common bleak","Alburnus alburnus","Cyprinidae",2,"Although unlikely to arrive in maritimes from it's typical vector (ballast water) the bleak has a very similar home ecology to here. It has been known to spread very rapidly when colonizing new areas. It also has a high reproductive rate for it's size (good disperser).",2,"It is likely that this species could colonize high value habitat, although it may have potential as a bait/forage fish and could be economically profitable.",2,"This species would likely displace other similar small fish in the food web, while also providing a benefit to the popualtions of smallmouth bass and chain pickerel and other larger predatory fish.",1,"Doesn't really affect overall ecosystem function, but could replace other small species in the food web.",7,"Yes","No","No",NA,"Common bleak","Fish",NA,"No","No","Yes","No","No","No","Yes","Yes",NA
"49","Common carp","Cyprinus carpio","Cyprinidae",1,"This species is usually farmed or moved by humans for the purpose of stocking ponds. Sometimes used as bait, juvenile carp can escape into new areas. As the populations in the great lakes seem relatively stable, there isn't too much concern about the establishment of the species in Nova Scotia",2,"This species has already colonized high conservation value habitat in the Great Lakes region so it is likely it would be able to do the same in NS/NB/PEI if introduced",2,"Common Carp is known to out-compete native species for both food and habitat.",2,"Common carp degrade water quality and destroy habitat for waterfowl, fish and amphibians. They are voracious feeders that forage primarily on plant seeds and insect larvae that live in lake sediments. While searching for food, carp burrow into lake sediments and in the process they uproot aquatic vegetation, increasing water turbidity and releasing large quantities of sediment-bound nutrients, which stimulate algal blooms. It is estimated that over 70% of lakes in southern Minnesota have lost their plant cover and suffer from excessive algal blooms due to carp’s foraging activity. Tens of thousands of hectares of waterfowl habitat have been devastated by common carp.",7,"Yes","No","No",NA,"Common carp","Fish",NA,"Yes","Yes","Yes","No","No","Yes","Yes","Yes",NA
"50","Common dace","Leuciscus leuciscus","Cyprinidae",2,"There is a slight chance of introduction through transoceanic shipping that may retain residual waters that contain fish eggs. Although, shipping to the Maritimes is oceanic, so ballast water exchange is standard practice and L. leucisus is unlikely to survive such salinity exposure (Baker et al. 2022).",2,"Where introduced in Ireland, L. leucisus establishment overlaps with brown trout, rainbow trout, and salmonoids (Baker et al. 2022). However, the species ability to spread trhoughout watersheds is not noted by Baker et al. (2022). Plus, as was previously noted, the chance of a primary introduction is relatively minimal.",3,"L. leucisus competes with native fish species for breeding habitat and food, which can lead to population declines of fish species of conservation status or economically-relevant species (Baker et al. 2022). Additionally, L. leucisus can hybride with chub, and therefore may impact chub species if established (Baker et al. 2022).",1,"L.leucisus is not known to alter phyiscal or chemical components of ecosystems.",8,"Yes","No","No","Salinity tolerance and probability of species to be introduced to Canada should be re-assessed.","Common dace","Fish","AISR, USGS","No","Yes","No","No","No","No","Yes","Yes",NA
"51","Common Fleabane","Pulicaria dysenterica","Asteraceae",1,"Considered a weed in its native range. Can form dense clusters of plants, spreading by its roots. Pathways include garden trade.",3,"marshy places like fen-meadows, reed beds, dune slacks, wet hollows, and the edges of lakes, rivers, canals, streams, ditches and seepages on sea cliffs. It is also found at the edges of damp woodland and roadside verges, and it is sometimes cultivated along pond edges in gardens, where it prefers sun and plenty of water",1,"Data deficient, but due to aggressive growth tendencies is likely to crowd out other species where established",0,"D.D.",5,"No","No","Yes","There is insufficient information in the literature on the potential impacts on native species and ecosystem functions of P.dysenterica","Common Fleabane","Plant",NA,"No","No","No","No","No","No","Yes","Yes",NA
"52","Common glasswort","Salicornia europaea","Amaranthaceae",1,"Not considered an aquatic invasive species, except a small portion of the UAE where an unreported colony is at risk, and therefore was likely captured by the intial analysis",1,"Will not colonize wetlands or freshwater systems. It grows in salt marshes and mangroves and dunes.",1,"No known impacts on aquatic species",1,"No known impacts on aquatic ecosystems",4,"No","No","No","Salt marshes and beaches are its habitat. Should be removed.","Common glasswort","Plant",NA,"No","No","No","No","Yes","Yes","Yes","Yes",NA
"53","Common Sawbelly","Hemiculter leucisculus","Cyprinidae",2,"unintentional introductions through stocking of other similar species is the greatest pathway of introduction.",3,"H. leucisculus is found in rivers, lakes, reservoirs, canals, and marshes. It keeps to the water surface in stagnant waters.",2,"H. leucisculus is considered as a pest in fish farms where it competes with juveniles of commercial species. It also harms the local fish fauna, and displaces the small, native species, most probably by predation. H. leucisculus may compete with the native species and might also feed on their eggs and fry. It has displaced native species in the Aral Sea Basin due to its higher resistance to predators, the high fecundity and its ability to eat a wide range of food.",2,"reported to impact ecosystem services but little data is available",9,"yes","No","yes",NA,"Common Sawbelly","Fish","AISR","Yes","Yes","No","No","No","No","Yes","Yes","Round goby eating eggs is a vector?"
"54","Coral Necklace","Illecebrum verticillatum","Caryophyllaceae",1,"Although it has been naturalised in a number of new sites (likely assisted by milder winters and human transportation) it is declining in its native sites without clear reason resulting in its Endangered GB Red List status. Coral necklace has been collected in gardens, nursery lots and waste areas in Massachusetts. No other North American collections are known.",2,"
Coral Necklace is most frequently found in seasonally-flooded hollows and pools in heathland and heath grasslands; and in seasonally-flooded track ways across heathlands or within conifer plantations on previously heathland sites. Ideally, Coral Necklace needs heavy levels of disturbance from grazing animals, such that occurs on the edges of temporary ponds, at pinch points created through heather or gorse, or along trackways",0,"D.D",0,"D.D",3,"No","No","Yes","Data is insufficient on the potential impacts of this species outside of its native range. Most of the literature refers to I.verticillatum as a species at risk and does not explore impacts.","Coral Necklace","Plant",NA,"No","No","No","No","Yes","Yes","uncertain","Yes",NA
"55","Cuban Bulrush","Oxycaryum cubense","Cyperaceae",1,"There was little information available on this species but it seems to be a wetland plant but can be found in rivers, streams, swamps, marshes, and ponds (Global Invasive Species Database). The species' range is mostly restricted to Mexico and southern US (iNaturalist).",0,"No data was located to indicate that this species has invaded areas of conservation value.",2,"Species forms dense floating mats that mipact light penetration. Also, the dense mats send out 'runners', which crowd out native plant species (Global Invasive Species Database).",2,"The impacts on native plants and the formation of dense mats will likely lead to decreased water flow and can alter plant assemblages.",5,"No","No","No",NA,"Cuban Bulrush","Plant","USFW","No","No","No","Yes","Yes","No","uncertain","during warm years",NA
"56","Curly leaved ponweed","Potamogeton crispus","Potamogetonaceae",3,"P. crispus is widely distributed through US and southern Canada (iNaturalist; Thayer et al. 2022). The species can be introduced through intentional plantings, waterfowl transfers, contaminated water used to transfer fish for aquaculture, and unclean boats.",3,"P. cripus is so widely distrubted that it must be found in areas of conservation value too.",3,"P. cripus establishment can impact native plant diversity, alter predator/prey relationships, impede water flow, cause stgnant water conditions, contribute to eutrophication and algal blooms, decrease oxygen concentrations, impede recreational water use (i.e. fishing, boating, swimming) (Thayer et al. 2022).",3,"As previous mentioned, P. cripus significantly imacts ecosystem functioning and structure.",12,"Yes","unnecessary","unnecessary",NA,"Curly leaved ponweed","Plant","USFW","No","No","No","Yes","Yes","No","Yes","Yes",NA
"57","Curly waterweed","Lagarosiphon major","Hydrocharitaceae",2,"Popular water garden and aquarium plant that has the potential to colonize large areas. The species spreads naturally via water current by fragmentations. Further spread is possible through unclean boats, gear, or equipment via hitchhiker pathway (Mikulyuk & Nault 2008). The species' history of introduction section on CABI indicated that although this species has the potential to spread widely through multiple vectors, thus far invasions have been relatively localised. If introduced to NS, it is likely to find suitable habitat, but long-term establishment may be limited by water temperatures (perferrence is >10 degrees C).",2,"uncertain as to whether or not the species suitable habitat in the Maritimes would overlap with species at risk or areas of high biodiversity. Also, no infirmation on species ability to spread through connected systems was located.",3,"If able to establish, the speceis is likely to outcompete native plants, forming monocultures. Similar to other inasvive plants, L. major is likely to damage ecosystem services thrugh loss of biodiversity and formation of dense mats impacting nutrient cyclings, water flow, and recreational water use (Mikulyuk & Nault 2008).",3,"Yes, likely to impact ecosystem functioning if able to establish.",10,"Yes","No","Ywa","Modeling needed to determine habitat suitability within Canada.","Curly waterweed","Plant","USFW, CABI","Yes","No","No","Yes","No","Yes","Yes","uncertain",NA
"58","Danuba crayfish","Pontastacus leptodactylus","Astacidae",2,"Distributed throughout Europe (iNaturalist) in lakes, ponds, and rivers. Species is able to handle both freshwater and brackish environments (Sea Life Base). No information is available on spread of species.",0,"d.d.",0,"d.d.",0,"d.d.",2,"No","No","No","Not a lot of information available on this species. Maybe something that Sicence could look into?","Danuba crayfish","Arthropod","USFW","Yes","Yes","Yes","No","No","No","Yes","Yes",NA
"59","Daphnia","Daphnia ambigua","Daphniidae",2,"Daphnia are an easily transported species via ballast water, therefore the risk is relatively low in this region. However, the possibility for transport via biofouling or recreational boating remains.",2,"Based on GBIF observations, this species has colonised areas all the way to Maine, and in areas of high conservation as well.",1,"We are at the northern end of the range for this species, and while it is cold tolerant and has established in Maine/Quebec, it remains to be seen if it would establish to population levels that would affect the stability of existing cladoceran population structures",2,"As a keystone species, daphnia spp. Can affect all levels of the food web, and therefore andy consequential shift in population structure would have cascading effects in the ecosystem",7,"Yes","Yes","No","Not much out there in terms of literature on the invasiveness of this species. It would be interesting to see the CMIST. CSAS unlikely needed as no specific questions with existing work.","Daphnia","Arthropod",NA,"No","No","No","No","Yes","No","Yes","Yes",NA
