"","species_common.x","species_latin","Family","Qu.1","RationaleQu1","Qu.2","RationaleQu.2","Qu.3","RationaleQu.3","Qu.4","RationaleQu.4","Global environmental risk","AISR_Listing","Secondary_Assessment","Science_Support","Notes.x","species_common.y","taxa","listed_elsewhere","pet_aquarium","Aquaculture","rec_fish","biofouler","Bilge Water","water_garden","possible_to_overwinter","suitable_hab_suspected","Notes.y"
"161","Rudd","Scardinius erythropthalmus","Cyprinidae",2,"S.erythropthalmus can disperse to connected waterbodies once introduced. However, the vectors of introduction (bait bucket, escape aquaculture and fish farms) are currently regulated or inactive in Nova Scotia (Siriwardena 2008). Therefore, there is a decreased risk of introduction. *Could be present in aquarium trade too, but need to confirm. Live Fish Possession Regulations do not apply to New Brunswick or PEI. Rudd have been widely introduced through a combination of bait bucket releases, escapes from aquaculture facilities and farm ponds, and, presumably, by dispersal from various points of introduction (e.g., Burkhead and Williams 1991).",2,"This species exhibits a wide range of environmental tolerances and therefore, could occupy habitat of conservation concern. Areas that are popular for recreational fishing are at higher risk of introductions than others (U.S. Fish and Widlife Service 2015). Rudd like to live in waters up to 3m deep. Rudd were previously described as a littoral species that prefers lentic habitats (Johansson 1987; Lake et al. 2002), however, recent studies of Rudd populations in the Niagara River found higher abundance, growth, and reproductive success in lotic versus lentic habitats (Kapuscinski et al. 2012a).  Rudd are often found in waters that are still or slowly moving with thick vegetation.",2,"The direct impacts of S. erythrophthalmus are not well understood but the species is expected to have similar impacts as other similar to goldfish. More specifically, S. erythrophthalmus may alter macrophyte communities leading to collapse of native macrophytes and facilitating establishment of exotic plants (U.S. Fish and Wildlife Service 2015). little data is avialble to answer this question but laboratory experiments by Burkhead and Williams (1991) demonstrated that rudd readily hybridize with native golden shiner, Notemigonus crysoleucas, a primary forage species of many native game fishes. As such, the probability exists that rudd introduced to open waters will hybridize with golden shiner, with unknown consequences to wild populations of the native species. Young rudd compete with native species for habitat and food, such as algae and small invertebrates.",2,"More research is needed to confirm whether this species' ecosystem impacts are high or medium priority, including whether the species' impacts on macrophyte communities result in altered ecosystem functions. Adult rudd can eat large amounts of aquatic plants along shorelines, which can degrade spawning and nursery habitat for native fish such as northern pike, muskellunge and yellow perch. - negative impacts to water quality",8,"Yes","Yes","Yes","Would be good to share species details with CBSA, C&P, and Province Conservation Officer as a species to 'look out for' coming across the border. This species can/is in US as forge fish for stripped bass.","Rudd","Fish","AISR, USFW","No","No","Yes","No","No","No","Yes","Yes",NA
"162","Ruffe","Gymnocephalus cernua","Percidae",2,"The species is introduced through ballast water transfers, which would limited in the Maritimes given the regions shipping industry is marine based. However, if the species was introduced  it is likely to find suitable habitat and would spread through connect waterways (Fuller et al. 2023).",2,"Species would be able to inhabit areas of conservation value in the Maritimes. This species has a wide range of water chemistry tolerances. The only species establishment threshold seems to be related to water depth (Fuller et al. 2023). Unfortunately, most lakes in Nova Scotia or PEI are not deep (i.e. <3-5m deep) but lakes and larger river systems in New Brunswick.",3,"If introduced, G. cernua would likely lead to population declines in native perch, whitefish, and shiners (Fuller et al. 2023). Since yellow lampmussel populations depend on white perch and Atlantic whitefish are also threatened in Nova Scotia, G. cernua is a major concern.",3,"Due to inter-species competition, especially with benthic fish, food web shifts as a result of changes to certain fish species abundance is likely. Where introduced to Lake Superior, G. cernua has become the dominant fish species making up ~80% of fish abundance in southernwestern regions of the lake (Fuller et al. 2023).",10,"Yes","Yes","Yes","Could be included as a mulit-species CSAS. MY biggest concern is determining the likelihood of species that arrive in the Great Lake via ballast water to be transferred to Eastern Canada via secondary spread vectors. Maybe a continuation of the Casas-Monroy et al. (2014) CSAS.","Ruffe","Fish","AISR, USFW","No","No","Yes","No","Yes","No","Yes","uncertain",NA
"163","Rusty Crayfish","Faxonius rusticus","Cambaridae",3,"This species is currently in New Brunswick, and with the recent invasions of other crayfish species, it is assumed it could further it's range expansion.",2,"This species has already colonized high conservation value habitat in the Great Lakes region so it is likely it would be able to do the same in NS/NB/PEI if introduced.",2,"This species can have direct impacts on freshwater plants and other benthic invertebrates",3,"Crayfish are known to be habitat eco engineers, where their burrows can cause river bank instability, and their feeding tendencies can have effects on biodiversity of invaded systems",10,"Yes","No","Yes","A full analysis of all potential crayfish invaders, with specific questions about enviro tolerances would be beneficial","Rusty Crayfish","Arthropod","AISR","Yes","Yes","Yes","No","No","No","Yes","Yes",NA
"164","Sailfin molly","Poecilia latipinna","Poeciliidae",2,"P. latipinna can travel large distances (sometimes up to 200 km) and there are multiple vectors that could lead to the species' introduction to Canada, namely the aquairum trade and stocking for mosiquote control (despite this species being mostly or compeltely herbivorous) (Smithsonian Environmental Research Center n.d.).However, the species ability to establish and spread is likely limited to artifically heated ponds or reservoirs.",2,"P. latipinna can inhabit freshwater, brackish, marine, and hyder-saline habitats. This species directly competes with Calorina killifish, Bahamas Pupfish, and Desert Pupfish (Smithsonian Environmental Research Center n.d.). Therefore, this species does inhabit areas of conservation where threatened or rare species exist. However, P. latipinna establishment in Canada would likely be limited to areas with water temp >7 degrees C. This would limit the species establishment to areas where hot spring or artifically heated water exists.",2,"P. latipinna can inhabit a wide range of ecosystems and will compete with other small-bodied fish and exhibits agression towards other small fish (Smithsonian Environmental Research Center n.d.). Therefore, P. latipinna can have localized impacts on invaded ecosystems.",1,"P. latipinna may have localized impacts on ecosystem functioning through food web shifts.",7,"Yes","No","uncertain","Pistia stratiotes","Sailfin molly","Fish","USFW","Yes","No","No","No","No","Yes","uncertain","uncertain",NA
"165","Schneider or Chub","Alburnoides bipunctatus","Cyprinidae",1,"Seems to be a threatened, sub-tropic species in Europe (FishBase n.d.). No vectors of introduction was identified.",1,"This species is threatened and has not been noted outside it's native range.",1,"No adverse impacts were noted. However, there is limited literature available for this species.",1,"Same as adverse impacts.",4,"No","No","No","This species is listed under Part 2 but I'm not sure why.","Schneider or Chub","Fish","AISR, FB","Yes","No","Yes","No","No","Yes","Yes","uncertain",NA
"166","Scud","Pontogammarus robustoides","Gammaridae",2,"It seems that dispersal information available on this species is limited. Shalaeva (2013) noted P. robustoides as 'constantly expanding its range of distribution' and that P. robustoides is a blacklisted species In Europe. Grabowki (2011) attributed the species' dispersal to fowling and shipping between inland waters. P. robustoides may be introduced to North America through shipping between the Baltic and the Great Lakes, but it is unclear if ballast water transfers at sea would prohibit the species' survival.",2,"P. robustoides is documented in lagoons, estuarine habitat, large rivers, and some lakes (Grabowki 2011; Shalaeva 2013). The species intensely consumes plants which would be a specific concern for Canadian estuarine habitat where eel grass beds are prioritized for protection. Furthermore, impacts to macroinvertebrates could impact salmon habitat in rivers and streams whre spawning occurs.",3,"P. robustoides has significant impacts on invaded ecosystems through herbivory, declines in native populations (especially native crustaceans and gammarids), shifts in macroinvertebrate community, introduction of microparasites, and abundance of algae (Shalaeva 2013). Overall, P. robustoides intorudction is expected to impact native biodeivsity, species richness, and biomass in the littoral zone.",3,"Due to impacts on aquatic plant commuities, it is expected that P. robustoides would alter the physical habitat. Furthermore, the negative impacts on native mussel communities would equate to a loss in nutrient cycling and water filtration.",10,"Yes","uncertain","Yes","It is not clear if this species would be introduced to Canada or where it would be established. I reocmmend that we conduct a detailed level assessment on this species.","Scud","Fish","USFW","No","No","No","No","Yes","No","Yes","uncertain",NA
"167","Seashore paspalum","Paspalum vaginatum","Poaceae",1,"In coastal habitats, it can spread at 1-2 m per year and become dominant over native vegetation. Seeds may also be spread through water movement. No other major pathways (potential for accidental movement through mvoment of garden waste)",2,"P. vaginatum is almost invariably associated with wet, saline conditions whether coastal or inland. It is found in coastal salt marshes of the tropics and sub-tropics. Most widespread in sheltered estuaries, lagoons and creeks that are influenced by tidal fluxes. It is found in coastal, often brackish areas. It often forms swards near the edge of mud flats, or on sandy and shingly shores, occasionally spreading into pasture nearby. It grows on estuarine mudflats, fine gravel, silty sand, sand; and in dryer situations above the high tide mark along exposed rocky coastlines, in crevices or beside brackish pools. It is not known inland (Graeme and Kendall, 2001).",2,"P. vaginatum can form dense monospecific groundcover in brackish marshes and estuaries, and affect the abundance of native species. This can lead to changes in invertebrate communities",3,"Williams et al. (2000) list potential effects of P. vaginatum in New Zealand to include modified hydrological and nutrient regimes, and changes in erosion and deposition. ISSG (2016) refers to modification of hydrology/water regulation, purification and quality /soil moisture and general habitat degradation. Graeme and Kendal (2001) comment that P. vaginatum ‘may cause sediment build-up and change open sandy/mud flats into vegetated areas’. Invasion of P. vaginatum is associated with an increase in sediment accumulation and changing hydrology in New Zealand estuaries (Shaw and Allen, 2003; ISSG, 2016).",8,"Yes","No","Yes","potential for invasiveness is low but impacts may be high in areas where it has been introduced.","Seashore paspalum","Plant",NA,"No","No","No","No","No","Yes","Yes","Yes","Saltmarsh plant"
"168","Signal Crayfish","Pacifastacus leniusculus","Astacidae",2,"Like other crayfish species, this species has high dispersion potential as introductions are known to have occurred for the purposes of prey for psortfishing. This crayfish is also fished extensively. It doesn't seem to expand it's territory as fast as other crayfish species.",2,"This species has the potential to colonize high value habitat. It has done so already in the SF Bay area. If introduced to the NS/Maritimes region it could cause serious impacts on high value habitat. Only rated 2 because it seems to be localized to the west coast for now.",2,"This species can have direct impacts on freshwater plants and other benthic invertebrates. It is also a known disease vector for other species of crayfish. It can easily outcompete other",3,"Crayfish are known to be habitat eco engineers, where their burrows can cause river bank instability, and their feeding tendencies can have effects on biodiversity of invaded systems",9,"Yes","Yes","No",NA,"Signal Crayfish","Arthropod",NA,"Yes","Yes","Yes","No","No","No","Yes","Yes",NA
"169","Silver carp","Hypophthalmichthys molitrix","Cyprinidae",2,"Species main avenue of introduction is through intentional introductions to aquaculture pond to control phytoplankton, after which the species may escape the ponds during flood periods or if enclosure screens are damaged and then naturally dispeersal. The species is able to naturally disperse distances greater than 1km/year and is found throughout the Great Lakes system, which is connected through a series of canals and locks (Bonham & Kurwie 2019). Although this species is expected to spread widely if intrdocued the risk of initial introduction is lower for this vectors because aquaculture ponds and species brought into aquaculture facilities are regulated through the Introductions & Transfer permitting process and aquauclture site plans.",3,"H. molitrix inhabits a variety of freshwater ecosystems and could inhabit both urbanized and natural habitats (Bonham & Kurwie 2019). Since the species primary method of introduction is through aquaculture introductions, it is likely that if the species was permitted for use in aquaculture that any escapes for these facilities would result in an introduction to areas important for habitat value and recreational fishing due to many aquauclture sites occurring outside city centers (S. Kingsbury pers. comm.).",3,"H. molitrix is noted for competition with freshwater clams, larval fish, bigmouth buffalo, and paddlefish in the US (Bonham & Kurwie 2019). Also, the H. molitrix can depleete plankton populations which affects other planktivorous species such as juvenile fish and mussels (Bonham & Kurwie 2019).",3,"H. molitrix's over consumption of plankton populations, especially is H. molitrix occurs at high densities, can impact trophic structures of and nutrient cycling (Bonham & Kurwie 2019).",11,"Yes","No","Yes","More advice is needed on the social science side, specifically what is the proportion of aquaculture facilities using carp as biocontrol?","Silver carp","Fish","AISR","No","Yes","No","No","No","Yes","Yes","Yes","Does not have a climae match assessment"
"170","Small Duckweed","Lemna minuta","Araceae",2,"Dispersion potential is high, as there are multiple vectors that may contribute to its spread (i.e. ornamental and water garden, as well as water fowl, and surface drift over short distances)",2,"It is likely that this species has the ability to colonize high value habitat, and as it is known to spread easily and cause widespread issues, it is likely to impact these areas as well.",2,"The species forms floating mats which may have a negative impact on wetland ecosystems by suppressing submerged macrophyte species. It is known to outcomete native species easily as it use high intensity light better than most similar plants.",3,"It affects the ecology of its habitat by forming mats on the water surface, reducing sunlight penetration and oxygen exchange. These impacts are considered moderate to severe",9,"Yes","Yes","Yes","Could be combined with other matting plants as an overall CSAS question/request for info","Small Duckweed","Plant",NA,"No","Yes","No","No","Yes","Yes","Yes","Yes",NA
"171","Small-flowered rose","Rosa micrantha","
Rosaceae",0,"not a riparian or aquatic plant",0,"not a riparian or aquatic plant",0,"not a riparian or aquatic plant",0,"not a riparian or aquatic plant",0,"No","No","No",NA,"Small-flowered rose","Plant",NA,"No","No","No","No","No","Yes","Yes","Yes","does not grow in or near water and has no aquatic lifestage"
"172","South American waterweed","Elodea callitrichoides","Hydrocharitaceae",1,"The literature sourced for this assessment mostly referred to E. muttallii and/or E. canadensis, both of which are highly invasive species. Josefsson (2011) did noted attempted introductions of E. callitrichoides to Austria, Germany, and Sweden, none of which became established. E. callitrichoides is native to temperate South America and may be limited in dispersal based on temperature thresholds.",1,"No literature indicated this species was established in areas of conservation value. However, similar Elodea spp. Are well established in conservation areas.",1,"Unlikely to establish in canada and therefore, unlikely to impact native species.",1,"Unlikely to establish in canada and therefore, unlikely to impact ecosystem function.",4,"No","No","Yes","Prehaps a multi-species CSAS on Elodea spp. That would also cover E. callitrichoides would identify which Elodea could be introduced and established in Canada.","South American waterweed","Plant","USFW","Yes","No","No","Yes","No","Yes","Yes","uncertain",NA
"173","South European nase","Protochondrostoma genei","Cyprinidae",0,"d.d.",0,"d.d.",0,"d.d.",0,"d.d.",0,"No","No","No","Species information is extremely limited, only one paper on Web of Knowledge available, 27 observation on iNaturalist, no risk assessments available, and limited information of FishBase.","South European nase","Fish","USFW","No","Yes","Yes","No","No","No","Yes","uncertain",NA
"174","Spatulaleaf loosestrife","Lythrum portula","Lythraceae",1,"Limited range currently in western N America. No signs of rapid expansion of range",1,"The species has not shown a propensity to invade senstive habitats.",1,"Does not seem to have strong effects on native species, except where native species might also be creeping ephemeral pond plants which might be outcompeted.",1,"unlike it's purple cousin, this species does not seem to exert overall negative effects on the ecosystem.",4,"No","No","No",NA,"Spatulaleaf loosestrife","Plant",NA,"No","No","No","No","Yes","Yes","Yes","Yes",NA
"175","Spiny cocklebur","Xanthium spinosum","Asteraceae",3,"X. spinosum is a highly invasive plant classified as one of the world’s worst weeds. It is a common agricultural and pasture weed and a declared noxious species in many countries. It has spread widely, via its spiked seeds which attach to animals and clothing or are a contaminant of hay, forage and other agricultural products. Accidental introduction very likely due to widespread distribution. The fruits float and are readily dispersed by water and can spread rapidly along watercourses.",2,"Prefers moist soil. Grows along roads and in disturbed areas and abandoned fields, also being sometimes common around waterholes and along floodplains, canals, ditches, creek flats, river terraces, and other moist places. It can also be common weed in cultivated fields, stock yards and abandoned settlements. Can adapt to a range of climatic conditions and to thrive where the soil has been disturbed, allowing it to grow in pasture, wasteland, sheep camps, as well as coastal areas, watercourses, dam banks and floodplains.",3,"X. spinosum can compete both directly and indirectly with native species, alter habitats and, when present on river banks, can increase soil erosion and affect water flow and quality. Major host of pest species Russelliana solanicola (South American potato psyllid). It competes with agricultural crops such as soybeans and cotton, leading to a drastically reduced yields. In the seedling stage, X. spinosum is poisonous to animals as the seeds contain hydroquinone, contaminating animal forage.",3,"Modification of hydrology, negatively impacts animal health and agriculture, reduced native biodiversity, habitat alteration and modification of successional patterns.",11,"Yes","No","Yes","There is significant data on this species as a noxious weed, but it would be beneficial to gain more information on the impacts to aquatic habitats (most of the literature is from a terrestrial habitat and agricultural impact lens)","Spiny cocklebur","Plant",NA,"No","No","No","No","No","Yes","Yes","Yes",NA
"176","Spiny naiad","Najas marina","Hydrocharitaceae",3,"Species able to spread hundreds of kilometers through seed dispersal by mallard ducks (Cao & Berent 2023). N. marina can also spread by fouling boats and fishing gear or through connected systems via seed dispersal and plant fragmentation (Cao & Berent 2023).",3,"Species' dispersal capabilities may lead to introduction to conservation areas.",0,"d.d.",0,"d.d.",6,"No","No","Yes","This would be up to Sicence if there is enough information available to complete an impact assessment. It may involve fieldwork to visit Great Lakes locations where species is established to determine potential impacts.","Spiny naiad","Plant","USFW","No","No","No","Yes","Yes","Yes","Yes","Yes",NA
"177","Spiny water flea","Bythotrephes longimanus","Cercopagididae",3,"B. cederstroemi can be introduced to new areas via fouling fishing lines and gear (Leibig et al. 2023). However, the species establishment in Nova Scotia or PEI may be limited to a few lakes due to most lakes being relatively shallow. Species may find more suitable lakes in New Brunswick where larger rivers and deeper lakes exist.",3,"The species is established in all the Great Lakes and likely occassionally overlaps with areas of conservation value but Leibig et al. (2023) indicated that most Great Lakes have low B. cederstroemi population densities.",2,"Species consumes 75% of body-weight in zooplankton daily, which impacts the abundance of native species. Also, B. cederstroemi is a prey species for multiple native fish species including bass, shiners, salmon, chub, whitefish, rainbow smelt, herring, sculpins, perch, and walleye (Leibig et al. 2023). Therefore, it is unclear what the level of impact would be if B. cederstroemi were introduced to Atlantic Canada.",2,"Declines in zooplankton are known to be especially detrimental to ecosystem function as food webs can be irreversibly changed.",10,"Yes","No","No",NA,"Spiny water flea","Arthropod","AISR, USGS","No","No","No","Yes","Yes","No","Yes","Yes",NA
"178","Spoonleaf arrowhead","Sagittaria platyphylla","Alismataceae",2,"Species is available for purchase within water garden trade. The species could spread via seeds and vegetatively via corms (Center for Invasive Species and Ecosystem Health n.d.).",0,"d.d.",0,"d.d.",2,"There is a lack of information available on this species, but  the Center for Invasive Species and Ecosystem Health (n.d.) indicates that the plant grows in dense colonies (up to 5 ft tall), which restricts water flow, increases sedimentation, and can cause regional flooding.",4,"No","No","Yes","A literature review is needed to determine what information is available on this species and more clearly identify gaps.","Spoonleaf arrowhead","Plant",NA,"No","No","No","No","No","Yes","uncertain","uncertain",NA
"179","Spotted halfbarbel","Hemibarbus maculatus","Cyprinidae",3,"H. maculatus has been accidentally introduced together with Chinese carp fry from the Yangtze River, China to USSR (Welcomme, 1988). It has partially displaced local species. It shows more rapid growth and higher fecundity than under native conditions. Natural dispersal rate is high.",3,"Lakes, rivers, reservoirs, streams and creeks with moderate flow and sandy bottoms",3,"H. maculatus has been recorded to be a serious competitor to and threat for the native benthic fishes, where it is introduced . When it was, for example, introduced from the Yangtze River, China in the USSR, it has partially displaced local species. One of the characteristics of this species that make it a successful invader is the fact that it shows more rapid growth and higher fecundity under introduced compared to native conditions.",3,"Modification of natural benthic communities, negatively impacts aquaculture/fisheries, reduced native biodiversity, threat to/ loss of native species",12,"Yes","No","No","There is sufficient scientific evidence to support listing and to understand ecosystem impacts of this species.","Spotted halfbarbel","Fish",NA,"No","No","No","No","No","No","Yes","Yes",NA
